{"approved_class_names":["smart-home__section","smart-home__stage--relative"],"approved_class_names_unchanged":true,"architect_contract":{"approved_class_names":["smart-home__section","smart-home__stage--relative"],"selected_candidate_id":"ARCH-FAM-C","source_ref":"synthetic-intermediate-bundle-001"},"blocking_dependencies":[],"builder_decisions_required":0,"builder_package_status":"executable_ready","confirmation_request":{"confirmation_id":"CONFIRM-INTERMEDIATE-001","confirmed_action_ids":["BATCH-INTERMEDIATE-001-A01"],"expected_user_token":"تایید BATCH-INTERMEDIATE-001"},"first_safe_builder_batch":{"actions":[{"action_id":"BATCH-INTERMEDIATE-001-A01","action_type":"preserve_structure","parameters":{"strategy_map_ref":"ISM-INTERMEDIATE-001"},"requires_decision":false,"target_node":"node-root"}],"batch_id":"BATCH-INTERMEDIATE-001","risk":"low"},"package_id":"BEP-INTERMEDIATE-001","qa_status":{"production_ready":false},"review_ref":"CRR-INTERMEDIATE-001","schema":"ev4-builder-executable-package@1.0.0","selected_candidate_id":"ARCH-FAM-C","selected_candidate_id_unchanged":true,"selected_candidate_locked":true,"strategy_map_ref":"ISM-INTERMEDIATE-001"}
